{"$schema":"https://json-schema.org/draft/2020-12/schema","$id":"urn:aicontrolcenter:governance:v1:authorization-receipt","title":"GovernanceAuthorizationReceipt","type":"object","additionalProperties":false,"required":["schema_version","authorization_id","request_id","decision_id","lifecycle_id","state","approved_scope","mutation_budget_id","precondition_snapshot_digest","issued_at","expires_at"],"properties":{"schema_version":{"const":"governance/v1"},"authorization_id":{"$ref":"#/$defs/text"},"request_id":{"$ref":"#/$defs/text"},"decision_id":{"$ref":"#/$defs/text"},"lifecycle_id":{"$ref":"#/$defs/text"},"state":{"enum":["AUTHORIZED","STALE","CONSUMED"]},"approved_scope":{"type":"array","minItems":1,"uniqueItems":true,"items":{"$ref":"#/$defs/text"}},"mutation_budget_id":{"$ref":"#/$defs/text"},"precondition_snapshot_digest":{"$ref":"#/$defs/text"},"issued_at":{"type":"string","format":"date-time"},"expires_at":{"type":"string","format":"date-time"}},"$defs":{"text":{"type":"string","minLength":1}}}
