{"schema_version":"governance/v1","authorization_id":"authorization-synthetic-001","request_id":"request-synthetic-001","decision_id":"decision-synthetic-001","lifecycle_id":"lifecycle-synthetic-001","state":"AUTHORIZED","approved_scope":["DOCS:UPDATE"],"mutation_budget_id":"budget-synthetic-001","precondition_snapshot_digest":"digest-snapshot-synthetic-001","issued_at":"2026-08-10T00:02:00+00:00","expires_at":"2026-08-10T01:02:00+00:00"}
